ID,Question,A,B,C,D,Answer,Subject
6,香睡莲是一种睡莲，是一种叶和花漂浮在水面的水生植物。预计这种植物的叶有以下哪些特征？,气孔在顶面以及导水（木质部）细胞相对较少,气孔在顶面以及导水（木质部）细胞相对较多,气孔在底面以及导水（木质部）细胞相对较少,气孔在底面以及导水（木质部）细胞相对较多,A,high_school_biology
7,以下哪项是自然选择直接作用的最小单位？,一个物种的基因频率,一个种群的基因频率,一个个体的基因组,一个个体的表型,D,high_school_biology
8,记忆丧失最有可能是由于脑哪个部位出现异常？,髓质,小脑,大脑,脑桥,C,high_school_biology
9,人类手臂、蝙蝠翅膀和海豚鳍这些不同的结构包含许多相同的骨骼，这些骨骼由非常相似的胚胎组织发育而来。生物学家如何解读这些相似性？,通过识别骨骼是同源的,通过趋同进化的原理,通过提出人类、蝙蝠和海豚具有共同祖先,仅 A 和 C,D,high_school_biology
10,将一块马铃薯放入装有纯水的烧杯中。以下哪项描述了马铃薯浸入水后的活性？,马铃薯中的水移动到周围的水中。,周围的水移动到马铃薯中。,马铃薯细胞质壁分离。,水中的溶质进入马铃薯。,B,high_school_biology
0,氮的电负性值介于磷和氧之间。下列哪一项正确描述了这三个值之间的关系？,氮的电负性值小于磷，因为氮较大，但大于氧，因为氮的有效核电荷更大。,氮的电负性值小于磷，因为氮的质子较少，但大于氧，因为氮的价电子较少。,氮的电负性值大于磷，因为氮的电子较少，但小于氧，因为氮较小。,氮的电负性值大于磷，因为氮较小，但小于氧，因为氮的有效核电荷较小。,D,high_school_chemistry
1,以下哪种物质的命名需要在阳离子后面使用罗马数字？,CaCl2,CuCl2,AlBr3,K2Cr2O7,B,high_school_chemistry
2,预期以下哪一项的电负性最高？,S,Fe,W,Ag,A,high_school_chemistry
3,将一摩尔下列化合物溶解在水中会产生不同 pH 值的溶液。在这些条件下，以下哪种酸的电离百分比最高？,HNO2,HClO4,H2S,H3PO4,B,high_school_chemistry
0,这个 Python 表达式的值是多少：1 + 3 % 3？,0,1,3,4,B,high_school_computer_science
1,哪些类型的函数增长最慢？,O(log e^N),O(log N),O(log log N),O(N),C,high_school_computer_science
2,以下哪项关于程序文档的说法是正确的？,程序文档在首次编写后不应更改。,程序文档仅在开发中的程序中才需要；程序完成后则不需要。,程序文档在程序员协作时很有用，但在程序员单独完成项目时则无用。,程序文档在初始程序开发期间以及对现有程序进行修改时都很有用。,D,high_school_computer_science
3,数码照片文件包含表示照片中每个像素的红色、绿色和蓝色级别的数据。该文件还包含描述照片拍摄日期和地理位置的元数据。对于以下哪个目标，分析元数据比分析数据更合适？,确定照片是天空照片的可能性,确定照片是在特定公共活动中拍摄的可能性,确定照片中出现的人数,确定照片投影到特定颜色背景上的可用性,B,high_school_computer_science
0,"本问题涉及以下信息。
“可是你呢，我亲爱的潘格罗斯，”赣第德说，“我怎么会又见到你呢？”
“这是真的，”潘格罗斯说，“你看见我被绞死了……一位外科医生买下了我的尸体，把我抬回家，解剖了我。他首先在我身上从肚脐到锁骨处做了一个关键的切口。没有人比我在绞刑时更惨了。神圣宗教裁判所的刽子手是个副执事，他非常懂得如何把人烧死，但他不习惯绞刑。绳子是湿的，不能很好地滑动，而且系得很紧。简而言之，当那个关键的切口让我发出可怕的尖叫使我的外科医生仰面朝天地倒下时，我仍然屏住了呼吸……[最后他]缝合了我的伤口；他的妻子甚至照顾我。我在十五天结束时站起来了……
有一天，我突然想到要走进一座清真寺，在那里我看到一位年长的伊曼和一位非常漂亮的年轻奉献者正在祈祷……她的捧花掉了；我把它捡起来，满怀敬意地递给她。我说得太久了，伊曼开始生气了，看到我是一个基督徒，他大声呼救。他们把我带到法官面前，法官命令在我脚底上鞭打一百下，然后把我送到大木船上。我和年轻的男爵被锁在同一条大木船上，同一条长凳上。这条大木船上有四个马赛的年轻人，五个那不勒斯的教士，两个科孚的修道士，他们每天都告诉我们类似的奇遇。男爵坚持认为他遭受的不公正比我更严重……我们一直在争论，当一连串的宇宙事件把你带到我们的厨房里时，你被牛鞭抽了二十下，你真是好心，把我们赎了出来。”
“嗯，我亲爱的潘格罗斯，”憨第德对他说，“当你被绞死、被肢解、被鞭打、被船拖着的时候，你总以为一切都会有最好的结果吗？”
“我仍然坚持我最初的看法，”潘格罗斯回答说，“因为我是一个哲学家，我不能收回我的意见，特别是莱布尼茨永远不会错；此外，预先建立的和谐是世界上最好的东西，他的真空和枯草也是如此。”
伏尔泰，法国启蒙运动作家，1759 年
憨第德所说的“一切总会有最好的结果”可以看作是反映了启蒙运动相信",如果运用科学的方法，社会是可以完善的,一个没有强大中央权威的民族注定要生活在自然状态中,政府的唯一目的是保障生命权、自由权和财产权,只有自由市场才能引领国家走向财富和幸福,A,high_school_european_history
1,"本问题涉及以下信息。
以下是 1889 年巴黎世博会的介绍。
“在博览会期间，特别是在 8 月份，当大会和法国协会召开会议时，在巴黎研究人类自然历史的机会在人类学史上是无与伦比的。在任何时候，法国首都都为人类学家提供了难得的优势。穆斯卡和布洛卡实验室、伯蒂隆在司法宫的人体测量学操作、人类学会的课程、植物园的收藏、医学学会的原始工作设施以及医院都给比较解剖学家和生物学家提供了大量的就业机会。”
奥蒂斯·T·梅森，美国民族学家和馆长，1889 年
从文中可以推断，在巴黎世博会时，科学界正在发生变化，因为",女性的加入,法国首都官员增加了资金,许多欧洲国家普及公共教育的发展,新的专业领域的发展,D,high_school_european_history
2,"本问题涉及以下信息。
“中国皇帝陛下同意，允许英国臣民及其家庭和机构在广州、厦门、福州、宁波和上海等城镇居住，以进行他们的商业活动，而不受骚扰或限制；英国女王陛下将任命总督或领事官员在上述每一城市或城镇居住，作为中国当局与上述商人之间联系的媒介，并监督英国女王陛下的臣民依法履行中国政府的正当义务和其他义务。”
《南京条约》，1839 年
这个条约中提供的让步最直接地制造了英国",殖民地,势力范围,保护国,商业,B,high_school_european_history
3,"本问题涉及以下信息。
请阅读下面的回忆录。
他不但希望所有高贵的人都经常到宫里来，而且很快就注意到那些地位低下的人都不在。在他的杠杆下，在他的沙发上，在他的饭桌上，在凡尔赛宫的花园里（这是唯一一个允许廷臣跟随他的地方），他总是左右打量；什么也逃不过他的眼睛，他能看见每个人。如果有谁经常住在宫里，他一定要知道原因；那些只短暂到访的人，也必须作出令人满意的解释；谁要是很少或从不在那儿露面，就一定会引起他的不快。如果让他帮这样的人一个忙，他会傲慢地回答：“我不认识他。”对于那些很少露面的人，他说：“他是一个我从未见过的人。”而且对这些评判无法进行上诉。
路易十四比任何人都更懂得如何通过施恩的方式来提高施恩的价值；他知道如何充分利用一个词、一个微笑，甚至是一个眼神。
他喜欢一切华丽、宏伟和丰富的东西，并鼓励他的宫廷里也有类似的品味；把钱随意地花在设备和建筑上，花在宴会和打牌上，这些都无疑是赢得他的好感（也许是为了从他那里获得一句话的荣誉）的一种方式。政策动机与此有关；通过使昂贵的习惯成为一种时尚，对处于某种地位的人来说，这是一种必需品，他迫使他的廷臣入不敷出，并逐渐使他们依赖他的奖赏来维持生活。
——圣西门公爵，《路易十四及其朝廷和摄政回忆录》 1750
以下哪项是路易十四统治时期最大的缺点和遗憾？",他对贵族的统治使他没有朋友和盟友。,他太在意仪式和外表，以至于没有很好地治理他的国家。,他把王国的管理交给了被称为总管的职业官僚。,他在位的三分之二时间处于战争状态，并联合其他大国反对他。,D,high_school_european_history
4,"本问题涉及以下信息。
阅读下面的文档。
来源 1
棉花是一种进口商品，它由其他国家供应，而且在任何地方都能以平等的条件获得，如果通过机器的使用，棉花的生产取得了如此惊人的成功，那么，因为羊毛是我们本岛的产品，是所有国家都需要的商品，几乎是人类的通用服装，最大限度地培育羊毛的生产，难道不应该有更大的好处吗？
在毛织品的生产中，涂布机、纺纱机和飞梭减少了近三分之一的手工劳动，它们每一种刚推出时都引起了劳动者的警觉，但它们都对提高工资和促进贸易作出了贡献，因此，如果现在有人企图剥夺我们使用它们的权利，毫无疑问，每一个从事这项事业的人都会竭力捍卫它们。
——利兹布商的声明，1791 年
来源 2
大名鼎鼎的农民小伙子们来了
他们喜欢喝棕色的好麦酒
打倒每一个傲慢的暴君
拿着斧头、长矛和枪！
这群小伙子们
勇敢的小伙子们
挥动有力的武器
打破藩篱
农民小伙子们冲我来了！
虽然特殊情况还在继续
士兵们每晚在我们周围欢腾
小伙子们仍一马当先
拿着斧头、长矛和枪！
这群小伙子们
勇敢的小伙子们
挥动有力的武器
打破藩篱
农民小伙子们冲我来了！
——《路德运动之歌》，《农民之歌》，c。1812 年
以下哪一项最好地描述了 1850 年前政府对来源 2 中所见的投诉的反应？",1850 年以前，政府几乎没有解决工业化的问题。,改革运动导致了对工人的工作时间、年龄和性别的规定。,在英国开始使用自来水和下水道。,政府建立了一个全国性的医疗保健系统。,B,high_school_european_history
5,"本问题涉及以下信息。
请读下面这封信。
发生了一件事…… 一个西班牙人看到了一个印第安人…… 吃一块从被杀的印第安人身上取下来的肉…… 我把犯人烧死了，并解释说，原因是他杀了那个印第安人，吃了他，这是陛下和我以你的名义所禁止的。我进一步让酋长明白，所有的人…… 必须戒掉这个习俗…… 我来…… 保护他们的生命和财产，并教导他们，他们只崇拜一个上帝[，]…… 他们必须离开他们的偶像和他们一直奉行的仪式，因为这些都是魔鬼编造的谎言…… 和欺骗…… 同样，我也来教导他们，陛下根据上帝的旨意统治着宇宙，他们也必须服从帝国的枷锁，并按照我们陛下的大臣所吩咐的去做。
——赫南·科尔特斯，给神圣罗马帝国皇帝查理五世的第五封信，1521 年
下列哪项不是 17 世纪末欧洲人征服美洲的结果？",欧洲人在美洲海岸和整个非洲大陆建立了海外殖民地。,欧洲的殖民扩张导致了全球商品、动植物、文化习俗和疾病的交流。,欧洲人创造了庞大的全球贸易网络，使他们能够积累大量财富。,欧洲人扩大了非洲奴隶贸易，以应对美洲种植园经济的建立和土著人的人口灾难。,A,high_school_european_history
6,"本问题涉及以下信息。
我认为，廷臣的主要和真正的职业应该是军事职业；我希望廷臣积极地遵循这一原则，并以勇敢、坚强、忠于他所服务的人而闻名. ……
我希望廷臣体格健壮，四肢匀称，表现出力量、轻盈和柔韧，并且懂得一切与战士相称的身体锻炼；我认为首先应该是在步行和骑马时熟练使用各种武器，了解每种武器的优点，特别是熟悉那些通常由绅士使用的武器……
我们的廷臣将会被尊为卓越，并将获得一切恩典，特别是说到……
我希望廷臣在文学方面有相当的造诣，至少在那些被称为人文学科的研究方面，不仅精通拉丁语，而且精通希腊语，因为许多令人钦佩的不同的东西是用拉丁文写的。让廷臣了解诗人，同时也不能忽略演说家和历史学家，还要精通诗歌和散文写作，尤其是我们这种粗俗的[本地]语言……
你必须知道，我不会对廷臣满意，除非他也是一个音乐家，除非他除了能读懂音符，还能弹奏各种乐器……
我希望我们的廷臣不要被称为说谎者或吹牛者，因为这些称谓有时会落到那些不应该被如此称呼的人身上。
——选自巴尔达萨雷·卡斯蒂廖内的《廷臣之书》，1528 年
下面哪一项改革是卡斯蒂廖内最希望实施的？",由国家出资建立男女同校的公立高中,由国家出资建立只招收男性的公立高中,建立公立大学，不分男女，都可以免费学习,为精英青年开办私立高中，提供许多课外活动,D,high_school_european_history
7,"本问题涉及以下信息。
第一条：德国、奥匈帝国、保加利亚和土耳其为一方，俄国为另一方，宣布它们之间的战争状态已经停止。各国决心从今以后彼此和睦相处。……
第三条：缔约双方商定的边界线以西以前属于俄国的领土，将不再服从俄国的主权；在作为本和平条约重要组成部分提交的地图上标出议定的界线。这条线的确切定位将由一个俄德委员会确定。
《布列斯特—立托夫斯克和约》，1918 年 3 月 14 日
条约第三条的结果是",德意志帝国西部向俄罗斯帝国投降,德意志帝国东部向俄罗斯帝国投降,俄罗斯帝国西部向德意志帝国投降,俄罗斯帝国东部向德意志帝国投降,D,high_school_european_history
0,关于劳动力中的妇女，以下哪项陈述是正确的？,大多数妇女务农,全世界从事经济活动的妇女在劳动力中所占的百分比下降了,妇女在总劳动力中所占比例下降,除盎格鲁美洲和澳大利亚外，所有地区的女性每天工作时间都比男性长,D,high_school_geography
1,在中心城区以外工作岗位多于居民的大型办公和商业用地节点是,郊区。,灵长类城市。,城镇。,边缘城市。,D,high_school_geography
2,以下哪项不是国家的向心力？,对中央政府的高度信任,存在强大的分裂主义团体,国家交通网络的存在,国歌,B,high_school_geography
3,Ralph 在附近的园艺商店购买园艺肥料，而不是驱车 50 英里到邻近的小镇购买同样的产品。这反映了哪种类型的空间互动？,可转移性,互补性,干预机会,地域性,C,high_school_geography
4,关于历史上的北美移民流，以下哪项说法是不正确的？,加拿大的第一大移民流来自法国。,加拿大的第二大移民流源自不列颠群岛。,加拿大的第三大移民流来自拉丁美洲。,美国的第一大移民潮源自欧洲。,C,high_school_geography
5,高速公路的建设会导致除以下哪一项外的所有结果？,城市无序扩张,交通流量增加,交通拥堵,减少对汽车的依赖,D,high_school_geography
0,如果将 1000 美元存入活期存款账户，超额准备金增加了 700 美元，则准备金率必须为：,70%。,30%。,40%。,90%。,B,high_school_macroeconomics
1,如果短期总供给曲线呈水平，那是因为,存在很多闲置资源，因此可以在不提高工资和价格的情况下增加产出。,任何产出的增加都需要工资和价格的相应增长。,产出的增加会导致价格上涨，但工资的调整速度要慢得多。,利率下降会增加对商品和服务的需求，从而对价格产生上行压力。,A,high_school_macroeconomics
2,在下列选项中，供给学派经济学家最可能倾向于,增加政府支出。,对进口商品征收更高的关税。,降低家庭收入税。,资本投资税收抵免。,D,high_school_macroeconomics
3,如果实际 GDP = 2000 亿美元，价格指数 = 200，那么名义 GDP 为,40 亿美元,4000 亿美元,2000 亿美元,20 亿美元,B,high_school_macroeconomics
4,美国利率降低会导致美元价值和出口发生以下哪种变化？美元价值     美国出口,提高     提高,提高     降低,降低     提高,降低     无变化,C,high_school_macroeconomics
5,某国政府决定增加相同数额的政府支出和税收，以保持预算平衡。MPC 为 0.75。在这种情况下，以下哪项是正确的？政策方向     支出乘数     税收乘数,扩张性     4     3,扩张性     4     -3,紧缩性     4     3,紧缩性     4     -3,B,high_school_macroeconomics
6,如果 A 国生产某种商品的机会成本低于 B 国生产同种商品的机会成本，则可以说,A 国在生产该商品方面具有比较优势。,B 国在生产该商品方面具有比较优势。,A 国在生产该商品方面具有绝对优势。,B 国在生产该商品方面具有绝对优势。,A,high_school_macroeconomics
7,经济增长最恰当的描述是,生产可能性曲线的上升和自然失业率的上升。,生产可能性曲线的上升和长期总供给曲线的左移。,生产可能性曲线的下降和长期总供给曲线的右移。,生产可能性曲线的上升和长期总供给曲线的右移。,D,high_school_macroeconomics
8,以下哪项不是国民收入的补充？,工资,薪水,利息,实物资本折旧,D,high_school_macroeconomics
9,以下哪项是经济衰退时扩张性货币政策的可预见优势？,减少总需求，使价格水平下降。,增加总需求，从而增加实际 GDP 和就业。,增加失业率，但物价降低会抵消这一影响。,保持高利率，从而吸引外国人投资。,B,high_school_macroeconomics
10,加利福尼亚州对焊工的需求很大，但失业焊工 Bill 却住在纽约。那么 Bill 属于,摩擦性失业。,周期性失业。,结构性失业。,隐性劳动力。,C,high_school_macroeconomics
11,假设不存在统计差异，贸易顺差只能在……的其他部分抵消。,经常账户余额,金融账户余额,商品贸易差额,经常账户或金融账户,D,high_school_macroeconomics
12,如果 2005 年国内生产了 200 台零售价值为 10 万美元的电脑，但直到 2006 年才售出，那么 2005 年的 GDP,因为这些电脑而增加 10 万美元。,因为这些电脑而增加 200。,不受影响，直到 2006 年电脑售出，2005 年的 GDP 数字才会被修正。,因这些电脑的批发价值而增加。,A,high_school_macroeconomics
13,总需求曲线,是市场需求曲线的水平总和。,是企业需求曲线的水平总和。,是单个商品需求曲线的简单汇总。,并不能通过将产品需求曲线横向或纵向相加得出。,D,high_school_macroeconomics
14,财政和货币政策制定者如何将支出税收和货币政策结合起来，在避免出现巨额预算赤字的同时应对衰退缺口？支出政策     税收政策     货币政策,增加支出     降低税收     出售国库券,减少支出     提高税收     购买国库券,减少支出     降低税后     提高存款准备金率,增加支出     提高税后     降低贴现率,D,high_school_macroeconomics
15,在短期内，价格水平上升和实际 GDP 下降可能是……的结果。,长期恶劣天气,货币供应量减少,消费者信心减弱,消费者信心增强,A,high_school_macroeconomics
0,我们掷 5 次公平 6 面骰子。最多掷 2 次得到 6 的概率是多少？,\frac{125}{648},\frac{25}{648},\frac{625}{648},\frac{1}{648},C,high_school_mathematics
1,假设 n > 1，其正除数的乘积是 n^6 的最小正整数 n 是多少？,30,64,2048,60,D,high_school_mathematics
2,Patrick 先生正在为他的班级准备一个五道题的正误测验。他在写第一道题之前抛硬币：若是正面，他写一个正确的陈述；若是反面，他写一个错误的陈述。他继续这样做，直到写完所有五道题。正确的答案顺序是 TFTFT 的概率是多少？将你的答案用公分数表示。,\frac{1}{6},\frac{1}{64},\frac{1}{32},\frac{1}{2},C,high_school_mathematics
3,有多少个 4 位数正整数的位只有奇数？,100,999,625,500,C,high_school_mathematics
4,200 的正平方根比 121 的正平方根大百分之几？用最接近的整数表达你的答案。,29,14,27,11,A,high_school_mathematics
5,将表达式 6j^2 - 4j + 12 重写为 c(j + p)^2 + q，其中 c、p 和 q 为常数。\frac{q}{p} 是多少？,3,-34,-38,11,B,high_school_mathematics
6,若我们把 sin x 变成 3 sin 2x，函数的定义域和值域会发生什么变化？,定义域和值域保持不变,定义域翻两倍；值域保持不变,定义域翻三倍；值域翻两倍,定义域不变；值域翻三倍,D,high_school_mathematics
7,假设 a、b、c 满足 a+b+c = 6、ab+ac+bc = 5 且 abc = -12。则 a^3+b^3+c^3 是多少？,90,99,64,91,A,high_school_mathematics
8,一笔 4000 美元的投资在 t 年后以每年 320*e^(0.08t) 美元的速度增长。10 年后的价值约为,"4,902 美元","8,902 美元","7,122 美元","12,902 美元",B,high_school_mathematics
9,求解 \log_8 2。,\frac{1}{4},4,3,\frac{1}{3},D,high_school_mathematics
10,Grady 骑他的自行车比他的弟弟 Noah 快 60%。若 Grady 在两小时内比 Noah 多骑 12 英里，Noah 每小时骑多快？,32,20,10,7.2,C,high_school_mathematics
11,当 a=42 时，求解 \left(\frac{1}{a}\right)^4 \cdot 2 \cdot a^4+a^{2+1-3}。,0,1,2,3,D,high_school_mathematics
12,在摩尔斯电码中，每一个符号都由一串破折号和点来表示。用总共 1、2、3 或 4 个点和/或破折号可以表示多少个不同的符号？,3,4680,30,10,C,high_school_mathematics
0,关于一个完全竞争企业，下列哪个说法是准确的？,需求是向下倾斜的。,需求曲线在边际收入曲线之上。,价格是由整个市场的均衡决定的。,平均收入与价格不同。,C,high_school_microeconomics
1,以下哪项不是寡头垄断的特征？,P = MC。,价格制定者。,进入壁垒高。,企业少。,A,high_school_microeconomics
2,如果一种产品的价格下降，而替代产品的价格保持不变，消费者就会购买更多的这种产品，这种情况被称为,收入效应。,替代效应。,边际效应。,供给效应。,B,high_school_microeconomics
3,牛仔裤市场处于均衡状态，而作为替代品的聚酯裤的价格上涨。在牛仔裤市场中,供给下降，价格上升，数量减少。,供给下降，价格上升，数量增加。,需求下降，价格上升，数量减少。,需求上升，价格上升，数量增加。,D,high_school_microeconomics
4,价格上限的特点是,设定的价格低于商品当前的（或均衡）市场价格。,设定的价格高于商品当前的（或均衡）市场价格。,需求曲线（函数）的移动。,供给曲线的移动。,A,high_school_microeconomics
5,在你最好朋友的生日派对上，你看到 Skylar 又吃了一块蛋糕。对这个人来说，肯定,第二块蛋糕的边际收益小于边际成本。,吃蛋糕产生的总收益在下降。,边际收益与边际成本之比小于 1。,第二块蛋糕的边际收益大于边际成本。,D,high_school_microeconomics
6,一个被描述为寡头垄断的行业最有可能,在长期有正常利润。,没有共谋行为的机会。,有显著的进入壁垒。,有接受价格的行为。,C,high_school_microeconomics
7,需求的工资弹性越大（越高），,在商品生产中，资本成本占劳动力成本的比例越大。,劳动生产的产品的价格弹性越大。,劳动替代品的数量越少。,时间越短。,B,high_school_microeconomics
8,对于弯折的需求曲线，下列哪项是不正确的？,没有价格领导者。,有相对平等的市场份额。,价格大于边际成本。,需求曲线是一个连续函数。,D,high_school_microeconomics
9,一名学生决定，已经花了三个小时为考试而学习之后，她应该再花一个小时为同样的考试而学习。下列哪项最有可能是正确的？,第四个小时的边际收益肯定小于第四个小时的边际成本。,第四个小时的边际收益至少和第四个小时的边际成本一样大。,如果不知道学生学习的机会成本，我们就无法知道她的边际收益是否大于边际成本。,第三小时的边际成本可能大于第四小时的边际成本。,B,high_school_microeconomics
0,当距离产生场的物体较远时，以下哪个物理量会随着距离的平方反比而减小？,有限长带电棒产生的电场强度,无限长带电圆柱体产生的电场强度,无限大带电平面产生的电场强度,无限长载流直导线产生的磁场强度,A,high_school_physics
