ID,Question,A,B,C,D,Answer,Subject
0,在参与编制非发行人财务报表时，会计师发现管理层将土地按评估价值列示，并且如果遵循公认会计准则（GAAP），则土地账户和股东权益都将减少 100 万美元，这是一个重大的金额。由于管理层不会修改财务报表，会计师决定修改标准编制报告。在这种情况下，会计师应：,因不符合 GAAP 而根据重要性发表否定意见或保留意见。,在会计师报告中添加一个单独的段落，将财务报表的分发限制为“仅用于内部使用。”,在会计师报告中添加一个单独的段落，披露不符合 GAAP 及其对财务报表的影响。,在会计师报告中添加一个单独的段落，解释按历史成本记录资产的基本目的。,C,professional_accounting
1,固有风险和控制风险与检查风险的区别如下：,固有风险和控制风险由客户计算。,固有风险和控制风险独立于审计存在。,固有风险和控制风险由审计员控制。,固有风险和控制风险是审计员对重大事项的判断的结果。,B,professional_accounting
2,在审查非发行人财务报表的过程中，会计员发现几项租赁应记入资本，但未记入资本。会计员认为这些租赁对财务报表具有重要影响。由于管理层不会将这些租赁记入资本，会计员决定修改标准审查报告。在这种情况下，会计员应当,由于违背公认会计原则 (GAAP) 而出具否定意见。,对实体的财务报表不发表任何形式的保证。,强调财务报表仅供有限用途。,在会计师的报告中，以单独一段披露违背 GAAP 的情况。,D,professional_accounting
3,在确定企业基金的分类时，下列哪个陈述是最重要的特征？,主要客户是基层政府。,活动的定价政策确定了旨在收回成本的费用和收费。,活动由债务融资，该债务部分由活动费用和收费的净收入抵押担保。,法律或法规要求通过税收或类似收入来收回提供服务的成本（包括资本成本）。,B,professional_accounting
4,"某非政府非营利组织持有下列投资：                        
投资成本，公允价值（年初），公允价值（年末）        
股票 A（100 股），每股 50 美元，每股 45 美元，每股 51 美元                                                        
股票 B（200 股），每股 40 美元，每股 41 美元，每股 49 美元                                                        
应在年终财务状况表中报告的股票投资金额是多少？","12,700 美元","13,000 美元","13,800 美元","14,900 美元",D,professional_accounting
0,一名 15 岁男孩被父母带到急诊科，因为他有 2 小时的精神错乱惑和躁动病史。在从夏令营回来后的两天内，他还出现了发热、头痛、颈部僵硬和呕吐。他的父母说他不使用违禁药物。到达时，他表现出好斗性，并有幻觉的迹象。他的体温为 40°C（104°F），脉搏 80 次/分，呼吸 17 次/分，血压为 100/70 mm Hg。进行了腰椎穿刺。脑脊液分析结果显示有囊肿和滋养体。下列哪种是病原体进入该患者中枢神经系统的最可能途径？,面神经,额窦,乳突小房,嗅觉神经,D,professional_medicine
1,一名 47 岁的男子因 2 小时前突然出现呼吸困难、剧烈胸痛和出汗被送到急诊科。他没有类似症状的病史。他患有高血压，正在服用氢氯噻嗪治疗。他每天抽一包烟，已有 30 年烟龄。他的脉搏为 110 次/分，呼吸为 24 次/分，血压为 110/50 mmHg。在左胸骨缘可以听到一个 3/6 级的吹风样舒张期杂音，向右胸骨缘扩散。双侧股动脉脉搏减弱。心电图显示左心室肥大。下列哪项是最可能的诊断？,急性心肌梗死,主动脉夹层,食管破裂,二尖瓣脱垂,B,professional_medicine
2,一名 26 岁女子因剧烈背痛和腹痛以及轻度但持续的阴道出血持续 8 小时被送到急诊室。腹部超声显示在壶腹部有一个 2 厘米的异位妊娠。壶腹部已经破裂进入周围组织。这种破裂的液体最可能会在下列哪个位置找到？,腹膜小腔,子宫系膜,道格拉斯陷凹,子宫腔,C,professional_medicine
3,一名 34 岁的女性因双腿水肿 3 到 4 周和体重增加 9 公斤（20 磅）的病史来看医生。病史包括镰状细胞特质和轻度贫血。她因一个月前被诊断为跟腱炎，每天三次服用 800 毫克布洛芬。她过去 15 年每天抽五支烟，每个周末喝一到五瓶啤酒。16 年前她曾短暂尝试过可卡因，但从未使用过静脉注射毒品。她过去 12 年一直处于单一性伴侣关系中。今天，她的生命体征为体温 37.2°C（99.0°F），脉搏 88 次/分，呼吸 16 次/分，血压 145/95 mm Hg。体检显示有眼睑水肿但无颈静脉怒张。肺部听诊清晰。心脏检查 S1 和 S2 未见杂音或奔马律。腹部检查显示有鼓胀，叩诊时有移动性浊音。下肢检查显示双侧大腿中部到脚踝都有凹陷性水肿。该患者的下列哪项研究结果最有可能异常？,HIV 抗体研究,血清 B 型钠尿肽浓度,尿液毒理筛查,尿蛋白浓度,D,professional_medicine
4,一名 64 岁的女性来看诊，因有大约 6 个月的吞咽唾液困难史。她说话含糊不清。舌头检查显示肌肉萎缩和肌束颤动。左下肢的深部肌腱反射减弱，并有肌束颤动。左上肢的深部肌腱反射亢进。最可能的诊断是,肌萎缩侧索硬化,腓德里希共济失调,皮克病,进行性多灶性白质脑病,A,professional_medicine
0,关于拥挤的影响，下列哪项是正确的？,与女性相比，男性更容易在拥挤环境中表现出攻击性行为。,与女性相比，男性更不容易因拥挤的环境而感到压力。,男性和女性对拥挤环境产生负面反应的可能性相当。,男性和女性对拥挤环境产生的攻击性反应程度大致相同,B,professional_psychology
1,关于催眠，最恰当的描述是一种对暗示的反应，涉及：,可测量的生理变化。,记忆、情绪和感知的改变。,对情境要求的依从性增强。,“人工睡眠”状态。,B,professional_psychology
2,将受测者的表现与特定受测者团体的表现进行比较的标准化测验或测量是：,标准参照测验,功能性行为评估,智力评估,常模参照测验,D,professional_psychology
3,根据欧文·亚隆的观点，团体治疗中的 ________ 类似于个体治疗中的心理治疗师-来访者关系。,普遍性,认同,凝聚力,联盟,C,professional_psychology
4,如果实验室进行的心理学研究的目的要求向被试隐瞒某些信息，则被试的同意,可豁免，前提是获得了被试直系亲属的书面同意,不是必要的，但有必要向被试解释研究情况,是必要的，并且必须提供可能影响参与意愿的重要方面解释,只有在可能有造成身体或心理伤害的风险时才有必要,C,professional_psychology
5,“系统方法”解决工商业问题的主要重点在于改善,组织绩效,工作习惯,组织士气,个人士气,A,professional_psychology
6,下列哪项关于企业强文化的说法是正确的？,其可促进文化和其他类型的变革,其与低水平的工作承诺相关,其与高水平的工作绩效相关,其与高水平的自愿离职相关,C,professional_psychology
7,您有一名新的来访者，她是一位 37 岁的女性，症状符合重度抑郁症的诊断标准。她在您为她提供了三次治疗后告诉您，她以前接受过另一位心理师的治疗，但在该心理师对她进行性骚扰后终止了治疗。她不想让您与任何人谈及此事。考虑到美国和加拿大心理学协会道德准则，您最妥当的做法是：,告知来访者存在保密限制，并报告不符合职业道德的行为。,告知来访者存在保密限制，并联系该心理师。,与来访者讨论她的选择并替她保密，除非她签署相应的授权书。,联系道德委员会，以便确定该情况下最妥当的处理程序。,C,professional_psychology
8,准实验设计与真实验设计的区别在于是否,从人群中随机选择被试,使用对照组或比较组,随机将被试分配到各组,使用有效且可靠的结果测量指标,C,professional_psychology
9,长期使用氯丙嗪的主要担忧是其可能引发下列哪种情况？,急性高血压危象,严重的顺行性遗忘,迟发性运动障碍,肾毒性,C,professional_psychology
10,根据哈里·斯塔克·沙利文的观点，下列哪种认知体验符合精神分裂症行为的特征描述？,不完善模式：私密符号和因果关联,毒性扭曲模式：以与早年生活相同的方式对待他人,未分化模式：能够言语前的离散、无关联状态,基本焦虑：在充满敌意的世界中感到无助/孤立,C,professional_psychology
11,客体关系心理疗法与弗洛伊德的心理动力学疗法相似，主要关注,依恋与分离问题,心理治疗师的中立角色,早期童年经历,自我、本我和超我,C,professional_psychology
12,在以来访者为中心的案例咨询中，顾问的主要目标是：,帮助咨询者确定如何更有效地为特定来访者提供治疗。,帮助咨询者确定评估其自身专业服务的方法。,帮助咨询者提高技能和知识，以便其在以后发挥更好的作用。,与咨询者合作，为来访者提供最佳干预措施。,A,professional_psychology
0,公关流程的 ________ 阶段包括决定采用哪些战略和战术来响应组织的目标并执行这些战略和战术。,规划,实施,评估,战术,B,public_relations
1,在哪种公共关系专业中，将人口细分为心理统计、人口统计和地理统计尤为重要？,问题管理,投资者关系,公共事务,营销传播,D,public_relations
0,"裘德洛 （Chodorow,1978）认为性别社会化是通过以下途径实现的：",男孩和女孩都很依恋母亲，但后来男孩脱离了母亲,女孩依恋母亲，但后来脱离了母亲,男孩依恋父亲，女孩依恋母亲,男孩和女孩都很依恋父亲，但后来女孩脱离了父亲,A,sociology
1,马克思宣称，当发生以下情况时，宗教会消失：,道德个人主义新趋势形成时,社会主义革命消除了对资本主义意识形态的需求,教堂出席率降至 15% 以下,人们开始更加相信科学技术,B,sociology
2,以下哪一项不被视为一个社会层面？,家庭,办公室,地球村,民族国家,B,sociology
3,沃纳和默达尔（Warner and Myrdal） 声称，以前是奴隶的黑人之所以没有加入北美城市的 “种族大熔炉”，是因为：,白人不信奉自由、平等和民主,他们希望保留强烈的原始民族身份,他们不准备从南方各州移居到北美,公民身份的承诺与持续的歧视相悖,D,sociology
0,目前全球有多少人感染了乙型肝炎？,3.5 亿,20 亿,"100,000",100 万,A,virology
1,副粘病毒科中的哪种病毒能够引起非常严重的义膜性喉炎？,麻疹,偏肺病毒,亨德拉病毒,呼吸道合胞体病毒 (RSV),B,virology
2,拉沙病毒和埃博拉病毒均是西非新出现的病毒。这些病毒的起源是什么动物？,人类,灵长类,果蝠,猪,B,virology
3,下列哪项是布尼亚病毒科的遗传特征？,含反义表达的三节段负链 RNA 病毒,高度可变的 RNA 病毒,通过节肢动物媒介传播的新兴病毒,使用 RT 酶,A,virology
0,在锡克教中，要想获得心灵的解脱，内心必须做到什么？,牢记神的名字,沉思神圣的赞美诗,牢记死亡在所难免,沉思世界的美好,A,world_religions
