ID,Question,A,B,C,D,Answer,Subject
1,以 30° 的发射角度、10 m/s 的初速度将静止在地面上的足球踢出。假设忽略空气阻力，计算足球的总飞行时间。,0.5 s,1 s,2 s,4 s,B,high_school_physics
2,两个相同的容器中分别装满了两种不同的气体，容器 1 装满了氢气，容器 2 装满了氮气，将两个容器放在实验桌上，让它们与室内空气之间达到热平衡。以下哪项对两种气体性质的比较是正确的？,氢气分子的平均动能比氮气分子的平均动能大。,氢气分子比氮气分子对器壁的平均作用力大。,氢气的密度比氮气的密度小。,如果不知道每个容器中的气体分子数量，就无法比较两种气体的压力。,D,high_school_physics
3,紫外线波长约为 6 × 10^-8 m，那么它的频率是多少？,5 × 10^15 Hz,0.5 Hz,2 Hz,20 Hz,A,high_school_physics
4,一个盒子放在一个斜面上，没有滑动。随着斜面角度（从水平方向测量）的增加，法向力,线性增大,线性减小,不变,非线性减小,D,high_school_physics
5,以下哪项正确描述了实物的自由落体运动？假设物体受到的阻力与速度成正比，并且在达到极限速度之前落到地面上。,在下落过程中，物体的速度和加速度都越来越大。,在下落过程中，物体的速度越来越大，加速度越来越小。,在下落过程中，物体的速度越来越小，加速度越来越大。,在下落过程中，物体的速度和加速度都越来越小。,B,high_school_physics
6,从桥上以 10 m/s 的初速度水平抛出一块石头。假设可以忽略空气阻力，石头经过多长时间才会落到桥下 80 m 的水面上？,1 s,2 s,4 s,8 s,C,high_school_physics
7,一颗人造卫星在大气层外绕地球做匀速圆周运动。一颗小流星在卫星轨道上的 P 点与其相撞，使卫星速度增加了 1%，但没有改变卫星的瞬时速度方向。以下哪项描述了卫星的新轨道？,卫星现在沿椭圆轨道运行，其中 P 点是距地球最远的位置。,卫星现在沿椭圆轨道运行，其中 P 点是距地球最近的位置。,卫星现在沿半径更大的圆轨道运行。,卫星现在沿半径更小的圆轨道运行。,B,high_school_physics
0,为了证明一个心理学理论，,你需要做一个实验。,你需要找到统计上显著的结果。,你必须重复你的发现。,要证明一个理论是不可能的。,D,high_school_psychology
1,在一项关于年龄和问题解决能力的研究中，研究人员测试了 20 名 10 岁、20 岁和 30 岁参与者的问题解决能力。这个研究者使用的是什么研究方法？,纵向,阶段,发展,横截面,D,high_school_psychology
2,任何经典条件反射例子中的第一步是什么？,在回应后跟着强化或惩罚,因与期望的行为相似的行为而强化有机体,将非条件刺激与条件刺激配对,用无条件的刺激（如食物）来奖励行为,C,high_school_psychology
3,研究表明，与心脏病相关的 A 类行为的最关键因素是,愤怒,竞争力,时间紧迫感,责任心,A,high_school_psychology
4,饥饿、口渴和性都与_____的刺激密切相关,脑桥,小脑,下丘脑,颞叶,C,high_school_psychology
5,在一项关于饮食习惯的研究开始时，研究人员问了参与者一系列问题，包括他们是否经常吃早餐。一个人是否吃早餐是一个,分类变量,连续变量,因变量,自变量,A,high_school_psychology
6,Georgia 在当地医院工作是因为她想帮助别人，而 Kathy 在医院工作完全是为了赚钱。她们的个人动机展示了_____两者的区别,主要和次要驱动力,阳性和阴性控制位点,同情和自主动机,内在和外在动机,D,high_school_psychology
7,神经元中指挥神经递质和蛋白质合成的部分是,细胞体,树突,轴突,轴突末梢,A,high_school_psychology
8,发展心理学家使用的主要研究方法是,案例研究,横断面研究,自然观察,实验法,B,high_school_psychology
9,一项研究表明，大多数人都能在一夸脱水中尝出一克盐的味道。以下哪个概念与该研究的目标最密切相关？,差异阈值,绝对阈值,品味恒常性,感觉适应,B,high_school_psychology
10,一个音调的感知音量主要取决于它的,频率,音色,振幅,泛音,C,high_school_psychology
0,成年男性的平均身高为 70 英寸，标准差为 4 英寸。成年女性的平均身高为 66 英寸，标准差为 3 英寸。对于一个身高 74 英寸的男性和一个身高 70 英寸的男性，在他们各自的性别中，谁的身高更不寻常？,无法确定，因为两组的平均身高是不同的。,无法确定，因为两组身高的标准差不同。,男性，因为他 74 英寸高，而女性仅 70 英寸高。,这个女性，因为她的身高比所有女性的平均身高高 1.33 个标准差，而这个男性的身高只比所有男性的平均身高高一个标准差。,D,high_school_statistics
1,在一项关于吃肉制品对体重水平影响的研究中，由 500 名承认每天至少吃一次肉的受试者组成的一个 SRS 与由 500 名自称素食者组成的一个独立 SRS 进行了体重比较。在第二项研究中，由 500 名受试者组成的一个 SRS 每天至少吃一顿肉，持续 6 个月，而另外由 500 名其他人组成的一个独立 SRS 被选中接受 6 个月的严格素食，并且他们在 6 个月后比较体重。,第一项研究是对照实验，而第二项研究是观察性研究。,第一项研究是观察性研究，第二项是对照实验。,这两项研究都是对照实验。,这两项研究都是观察性研究。,B,high_school_statistics
2,关于 χ2 概率分布函数，下列哪项是不正确的？,χ2 曲线下的面积为 1。,χ2 仅为了变量的非负值而定义。,当自由度较小时，曲线表现出较强的右偏态。,对于相同的α，随着自由度数的增加，拒绝域的临界值减小。,D,high_school_statistics
3,"一个大型百货商店每天服务的顾客数量是正态分布，平均为 3,250 人，标准差为 320 人。找出在中间 50% 的日子里服务的客户数量范围。","(3,034, 3,466)","(2,930, 3,570)","(2,610, 3,890)","(2,450, 4,050)",A,high_school_statistics
4,一个特定班级的身高（英寸）和体重（磅）之间的相关系数为 0.65。如果身高从英寸转换为厘米，相关系数是多少？（1 英寸 = 2.54 厘米）,-0.65,-0.26,0.1,0.65,D,high_school_statistics
0,"本问题涉及以下信息。
“谁和什么应该为非洲的不发达负责，这个问题可以从两个层面回答。首先，答案是，帝国主义制度的运作对非洲经济发展迟缓负有主要责任，因为它耗尽了非洲的财富，并且无法更快地开发非洲大陆的资源。其次，非洲必须对付那些操纵制度的人，以及那些作为上述制度的代理人或不知情的帮凶的人。西欧资本家积极地将他们的剥削从欧洲内部扩展到整个非洲。”
沃尔特·罗德尼，历史学家，《欧洲如何使非洲变得不发达》，1974 年
以下哪一项最能支持作者关于西欧资本家对非洲欠发达负有责任的断言？",为加勒比甘蔗种植园提供劳动力的奴隶贸易的积极扩张,阿拉伯商人不断向地中海市场出售非洲奴隶,荷兰东印度公司建立开普殖民地,欧洲和埃塞俄比亚之间贸易联系的增长,A,high_school_world_history
1,"本问题涉及以下信息。
火药武器：欧洲与中国
在 12 世纪到 15 世纪的西欧，早期的大炮虽然很重，但发射速度很慢，但它们在这一时期主导战争的旷日持久的围城战中被证明是非常有用的，因此各国政府觉得花钱购买它们是值得的，并进行了实验，最终生产出了威力更大、更容易移动的火药武器。相比之下，特别是在 14 世纪中期之后，中国主要受到机动性高的草原游牧民族的威胁，早期的火药武器由于笨重，对中国几乎没有用处。因此，它致力于改进马弓箭部队，以有效地打击这个国家最致命的敌人。
根据这篇文章，为什么中国人尽管发明了火药，却未能引领火药武器的创新？",儒家传统主义不鼓励他们这样做。,他们过于相信现有武装力量的数量优势。,他们顺理成章地决定发展更适合他们当前军事需要的武器。,他们负担不起采用新军事技术的初始费用。,C,high_school_world_history
2,"本问题涉及以下信息。
但是，罗马的衰落是过度强大的自然和必然结果。繁荣催生了腐朽；破坏的原因随着征服范围的扩大而成倍增加；一旦时间或意外事故消除了人为的支撑，这个巨大的结构就会屈服于自身重量的压力…… 胜利的军团在遥远的战争中沾染了陌生人和雇佣兵的恶习，先是压迫共和国的自由，后来又践踏了帝王的威严。皇帝们出于个人安全和公众安宁的考虑，不得不采取卑鄙的手段，败坏纪律，让他们令君主和敌人都害怕；军队的战力…… 涣散…… 罗马王国被野蛮人的洪水淹没。
——节选自爱德华·吉本 (Edward Gibbon) 著《罗马帝国衰亡史》
大多数古典帝国都有以下哪些特征？",他们要求被征服民族的文化同化，以限制帝国内部的多样性。,他们对外国宗教提供国家支持，以加强对政府的支持。,他们开始进行广泛的公共工程项目，以整合他们的帝国。,他们有基于功绩原则的政府官僚机构。,C,high_school_world_history
3,"本问题涉及以下信息。
“反对新殖民主义并不是要排斥发达国家的资本在欠发达国家开展业务。其目的是防止发达国家的金融力量被用来使欠发达国家陷入贫困。
加纳和许多其他国家所奉行的不结盟原则是建立在与所有国家合作的基础上，无论这些国家是资本主义国家、社会主义国家还是混合经济国家。因此，这种政策涉及资本主义国家的外国投资，但必须按照不结盟国家政府根据本国利益制定的国家计划进行投资。问题不在于外国投资者从其投资中获得多少回报……问题在于权力。一个被新殖民主义控制的国家无法主宰自己的命运。”
克瓦米·恩克鲁玛（Kwame Nkrumah）《新殖民主义》，1965 年
第二段中提到的来自资本主义国家的外国投资会最直接地导致以下哪项结果？",殖民国家对以前的殖民地建立正式控制,针对外国投资建立成功的民主制度,全球化的发展和消费主义带来的文化传播,减少前殖民地的政治不稳定和动荡,C,high_school_world_history
4,"本问题涉及以下信息。
“晚寝早作，勿惮夙夜，执务私事，不辞剧易，所作必成，手迹整理，是谓执勤也。
正色端操，以事夫主，清静自守，无好戏笑，洁齐酒食（齐音斋），以供祖宗，是谓继祭祀也。三者苟备，而患名称之不闻，
黜辱之在身，未之见也。三者苟失之，何名称之可闻，黜辱之可远哉！”
©普林斯顿大学东亚图书馆和格斯特收藏馆。
班昭，《女诫》，约公元 80 年
文章中的哪个主题在古代父权社会中是常见的？",关心他人事务的重要性,祭祖的重要性,系统地安排酒的重要性,女性纯洁的重要性,D,high_school_world_history
5,"本问题涉及以下信息。
伊尹祠于先王，奉嗣王祗见厥祖侯甸群后咸在…… 伊尹乃明言烈祖之成德，以训于王。
“呜呼！古有夏先后，方懋厥德，罔有天灾，山川鬼神，亦莫不宁，暨鸟兽鱼鳖咸若。于其子孙弗率，皇天降灾，假手于我有命。造攻自鸣条，朕哉自亳。惟我商王，布昭圣武，代虐以宽，兆民允怀。今王嗣厥德，罔不在初！
“呜呼！嗣王祗厥身，念哉！圣谟洋洋，嘉言孔彰！惟上帝不常，作善，降之百祥；作不善，降之百殃。尔惟德罔小，万邦惟庆；尔惟不德罔大，坠厥宗。”
——节选自《书经》，公元前 6 世纪，中国
根据短文，下列哪个说法正确地描述了公元前 600 年到公元 600 年中国的政治？",对自然的敬畏会带来安宁和权力的和平过渡。,统治者的公共行为被认为是他私人行为的延伸。,中国皇帝的智慧比道德行为更受重视。,皇帝的大臣们被期望无条件地支持他的所有政策。,B,high_school_world_history
0,如果一个人没有很好的组织能力，很少设定目标，经常把事情拖到最后一刻才去做，那么这个人的哪种特质较低？,宜人性,自觉性,开放性,神经质,B,human_aging
1,以下哪项不是老年人数量增加的主要原因之一？,婴儿潮一代,出生率稳步上升,出生时预期寿命的延长,特定年龄预期寿命的延长,B,human_aging
0,调解和调停之间有何区别？,调解是调停的延续，不同之处在于调解产生具有约束力的结果，而调停不产生具有约束力的结果,调解完全由联合国秘书长的代表进行，也可由第三国官员进行,调停通常由经过当事各方同意指定的人员进行，而调解则涉及一个委员会，该委员会对争议进行公正的审查，并提出解决条件,调解是一种仅根据条约进行的争端解决方法，而调停也可以是临时性的,C,international_law
1,根据国际责任法，一国的国家机关的所有行为是否都归咎于该国？,一国任何国家机关的行为应被视为该国的行为，即使该行为未经授权或越权,只有一国国家政府高层的行为才应归咎于该国的政府,一国任何国家机关的行为均应被视为该国的行为，条件是该行为没有超越权限,只有一国国家行政部门的行为才被视为该国的行为。,A,international_law
0,自然法则谬误是,认为某件事因为花钱不多就一定不好,在帮助归纳时用个例代替大样本,认为自然界中真实的东西对人类来说也一定是真实的,与后此谬误是一回事,C,logical_fallacies
1,诉诸于人的谬误是通过_______方式来否定主张,使用修辞,虚假陈述,无视当事人,批评提出主张的人,D,logical_fallacies
2,如果有人认为做出改变不会产生重大影响，但却没有证据表明影响不会很大，那么这个人犯了以下哪种谬误？,井里投毒,固体斜坡,诉诸传统,诉诸权威,B,logical_fallacies
3,形式上无效的三段论,实质上不可能为真,可能实质上为真,可能实质上不为真,B 和 C 都是,D,logical_fallacies
4,论辩者威胁他人以达成一致，就犯了________谬误,诉诸武力,诉诸虚伪 (tu quoque),不懂反驳,稻草人,A,logical_fallacies
0,您正在为一个简单的估计任务训练线性回归模型，并注意到该模型对数据过度拟合。您决定添加 $\ell_2$ 正则化来惩罚权重。随着 $\ell_2$ 正则化系数的增加，模型的偏差和方差会发生什么变化？,偏差增加；方差增加,偏差增加；方差减少,偏差减少；方差增加,偏差减少；方差减少,B,machine_learning
0,什么是规范性视角？,事物现在的样子。,事物未来的样子。,事物本来应该的样子。,事物过去的样子。,C,management
1,哪项不是公认的业务连续性规划形式？,应急规划,情景规划,财务规划,建设规划,D,management
2,根据五因素模型，“外向型”作为一种人格类型，什么样的人具有这一类型的特点？,天性善良,冷静、自信,敏感、好奇,有主见、善于交际,D,management
0,当企业/产品进入衰退期时，这些目标通常用于成熟市场。目标是最大化短期利润和刺激正现金流。,剥离目标。,持有目标。,增长目标。,收集目标。,D,marketing
1,经济营销应该鼓励长期经济发展，而不是短期经济发展。,生态、进化和经济,生态、公平、经济,进化、公平和经济。,生态、公平和新兴。,B,marketing
0,沿着岩石圈板块边界的应力积累导致下列哪一种情况？,地震,磁场逆转,飓风,深海沉积物沉积增加,A,miscellaneous
1,以下哪一种产品的需求最有弹性？,水,面包,盐,猪肉,D,miscellaneous
2,以下哪项需要使用至少两根针？,流苏花边,编织,钩编,手工编织,D,miscellaneous
3,谁不是电视剧《伯南扎的牛仔》中卡特赖特的儿子？,亚当,小乔,霍斯,本,D,miscellaneous
4,每次涨潮平均间隔多长时间？,3 小时 25 分钟,6 小时 25 分钟,12 小时 25 分钟,24 小时 25 分钟,C,miscellaneous
5,哪个职业运动队的主场比赛在阿拉莫多美球场举行？,纽约喷气机队,底特律老虎队,波士顿棕熊队,圣安东尼奥马刺队,D,miscellaneous
6,在一组跨接电缆上，什么颜色表示负极连接器？,黑色,红色,橙色,蓝色,A,miscellaneous
7,是什么力量使冰淇淋蛋筒从旋转的旋转木马上飞出去？,离心力,媒介力,引力,Torsal,A,miscellaneous
8,1999 年那场引发了一场关于审查制度的全国性辩论的艺术展叫什么名字？,Sticks & Stones',Pulsation',Black & White',Sensation',D,miscellaneous
9,如果一个企业根据第 11 章提出申请，它在做什么？,宣布破产,出售股票,买小一点的公司,公司起诉政府,A,miscellaneous
10,弗兰克·辛纳屈的歌曲《My Way》的歌词是谁写的？,弗兰克·西纳特拉,克里斯·克里斯特·奥佛森,卡罗尔·金,保罗·安卡,D,miscellaneous
11,在编织中，织机上的垂直线和水平线被称为,波宾和羽毛笔,梭子和桨,褶和合股线,经纱和纬纱,D,miscellaneous
12,英国菜“香肠和土豆泥”是由香肠和什么组成的？,鸡蛋,培根,肝,土豆,D,miscellaneous
13,约翰·洛克菲勒在哪个行业赚取了财富？,汽车,石油,钢,铁路,B,miscellaneous
14,在颅骨上钻孔的过程叫什么？,分岔,环钻术,高层大气物理学,欺骗,B,miscellaneous
0,血浆磷脂中的哪些脂肪酸与心血管性死亡率降低相关？,棕榈酸 (16:0),长链（= 20 个碳原子）饱和和 n-3 多不饱和脂肪酸,α-亚麻酸 (18:3),硬脂酸 (18:0),B,nutrition
1,测量全身水分时，通常使用什么稳定同位素？,氘,碳 13,氮 15,氧 18,A,nutrition
2,严格素食者可能缺乏维生素 B12 的占比为多少？,3%,32%,66%,15%,B,nutrition
3,关于脂肪酸β-氧化，以下哪种说法不正确？,脂肪酸 ß-氧化的主要部位是过氧化物酶体，线粒体也含有该途径所需的酶,在肝脏内，过氧化物酶体用作将极长链脂肪酸氧化为中链产物,β-氧化速率调节因素为脂肪酸可用性和 β-氧化产物的利用率,过氧化物酶体是外源性物质和类花生酸降解的部位,A,nutrition
4,使用双标水法识别日常摄入量少报的缺点是什么？,其采用复杂的分析技术,其仅可标记能量摄入,不能发现低能量食物的少报,以上选项均正确。,D,nutrition
5,为了让老年人的营养状况达到最佳，建议老年人摄入：,高能量饮食。,高营养饮食，且密集进食。,低能量饮食。,每日补充抗氧化剂。,B,nutrition
6,摄入水果和蔬菜,观察性研究发现与骨矿物质损失更大相关,与骨骼健康的关系不确定，因为相关生活方式因素（如吸烟、运动和饮酒）是研究的混杂因素,在补充剂研究中，始终导致骨丢失较少,对骨矿物质丢失有较大影响,B,nutrition
7,摄入混合餐后会发生复杂级联事件，其可在全身水平整合脂肪代谢。以下哪项是正确的？,进餐导致脂肪组织内脂肪酶活性受到抑制，从而导致血浆 NEFA 浓度降低,脂肪组织脂蛋白脂肪酶被胰岛素激活，因此前者在进餐后最活跃,VLDL 合成途径在餐后期间受到抑制，这有利于乳糜微粒水解,以上选项均正确,D,nutrition
8,“功能性隔离”一词是什么意思？,儿童在当时只发育出一种功能,儿童与适当的营养隔离（即没有获得足够营养），因此不能充分发育,营养不良、冷漠的儿童未接受相同环境刺激，这对其发育产生不良影响,以上都不是,C,nutrition
9,关于蛋白水解，以下哪种说法是正确的？,组织蛋白质的分解代谢速率在一天中基本上是恒定的（波动很小）。,所有组织蛋白的分解代谢速率基本上相同（波动很小）。,待分解代谢的所有蛋白质都用肽泛素标记。,溶酶体酶是组织蛋白质分解代谢的唯一机制。,A,nutrition
0,柏克莱认为，除了在_____中之外，可感知的事物不可能存在。,头脑,绝对的存在,物质实体,物质宇宙,A,philosophy
1,根据摩尔的说法，每当我们想到__________时，我们就会想到好的事：,快乐。,我们渴望的东西。,内在价值。,以上都不是。,C,philosophy
2,高蒂尔声称，实用理性没有什么可做的，除了：,道德证成。,审慎证成。,认识证成。,一种错觉。,B,philosophy
3,休谟将美德定义为：,一种最大化幸福的倾向。,一种追求正义的倾向。,任何心理行为或品质都能给观众一种赞许的感觉。,任何心理行为或品质都会给所有人带来最好的结果。,C,philosophy
4,伊壁鸠鲁认为哲学：,不适合年轻人。,不适合老年人。,很重要，但不愉快。,以上都不是。,D,philosophy
5,根据d'Holbach的说法，人们认为是非物质灵魂存在的证据的所有精神和道德属性实际上都是_____。,纯粹智力的,纯粹物理的和自然的,飘渺的,未确定的,B,philosophy
6,密尔声称，正义和其他道德义务的区别完全对应于以下两者之间的区别：,完全义务和不完全义务。,积极责任和消极责任。,强责任和弱责任。,绝对义务和相对义务。,A,philosophy
7,克雷格认为，卡拉姆宇宙论论证确立了_____。,基督教的上帝存在,宇宙是有原因的,宇宙大爆炸模型是错误的,宇宙是没有原因的,B,philosophy
0,认为文明的所有特征都在一个地方发展，如埃及，并从那里传播到世界其他地方的观点被称为：,文化进化,移民主义,传播论,非原旨主义,C,prehistory
1,土著人是什么时候占领澳大利亚内陆的？,"10,000–12,000 年前","20,000–25,000 年前","35,000–40,000 年前","40,000–45,000 年前",B,prehistory
2,中石器时代的贸易模式与旧石器时代晚期的贸易模式有何区别？,在中石器时代，商品流通距离更远，交换的商品也更多,在中石器时代，商品流通距离更远，但交换的商品却更少,在中石器时代，商品流通距离更短，但交换的商品更多,在中石器时代，商品流通距离更短，并且交换的商品更少,C,prehistory
3,最近对尼安德特人和现代人的基因组分析表明：,具有欧洲和亚洲血统的现代人类基因组中有 1% 到 4% 来自尼安德特人，这很可能是通过杂交实现的。,尼安德特人与解剖学上的现代人完全不同，没有杂交的证据。,全世界的解剖学上的现代人与尼安德特人共有大约 16% 的基因组。,现代非洲人与尼安德特人共有超过 4% 的基因组，远远超过现代欧洲和亚洲人口，这表明成功杂交的时间更长。,A,prehistory
4,最近对石器复制和脑成像的研究提出了以下假设：,工具制造过程中建立的联系使大脑为语言的产生和使用做好了准备。,工具制作需要合作，而这种合作只能与语言共存。,工具制造起源于语言进化后的数百万年。,大脑和两足运动之间的联系为手制作工具做好了准备。,A,prehistory
5,克洛维斯矛尖未在_____发现：,阿拉斯加。,墨西哥。,加拿大。,美国大陆。,A,prehistory
6,_________的做法使印加人大大增加了可耕地的数量。,灌溉,梯田,砍伐和焚烧,施肥,B,prehistory
7,为什么投矛器代表了一种有用的创新？它是什么时候出现的？,它使战争变得如此致命，以至于它在旧石器时代中期和石器时代中期开始被淘汰。,从旧石器时代中期和石器时代中期开始，它允许猎人进行艺术表达。,从旧石器时代晚期开始，它发射更大的长矛的速度更快，频率更高。,从旧石器时代晚期开始，它就以更大的力量和精度发射投射物。,D,prehistory
8,街头行人调查的适当性和有用性取决于：,初级和次级垃圾的存在。,自然暴露的层，在其中寻找人工制品、生态制品或骨头。,可以在人工制品、生态制品和骨头之间建立的联系。,一个人工制品隐藏处或集合的存在。,B,prehistory
9,关于米诺斯文明的起源，哪个是正确的？,克里特岛曾是埃及人的殖民地，他们称这个岛为“米诺雅”。,"早期人类在距今 150,000 年左右越过陆桥来到克里特岛，并逐渐成为米诺斯人。",克里特岛上居住着希腊人和其他人，但米诺斯文化是当地发展起来的。,克里特文化是埃及和美索不达米亚元素的混合体。,C,prehistory
10,“祖母效应”指的是：,许多旧石器时代妇女的过早衰老。,随着老年妇女开始表达自己，洞穴壁画发生了变化。,儿童死亡率的下降与老一辈人的存在有关。,女权主义考古学家在现场质疑男性偏见的倾向。,C,prehistory
